External Hub: USB#VID_1A40&PID_0101#6&6aaf50d&0&4#{f18a0e88-c30c-11d0-8815-00a0c906bed8}
Hub Power:               Self Power
Number of Ports:         4
Power switching:         Ganged
Compound device:         No
Over-current Protection: Global

Device Descriptor:
bcdUSB:             0x0200
bDeviceClass:         0x09
bDeviceSubClass:      0x00
bDeviceProtocol:      0x01
bMaxPacketSize0:      0x40 (64)
idVendor:           0x1A40
idProduct:          0x0101
bcdDevice:          0x0100
iManufacturer:        0x00
iProduct:             0x01
0x0409: "USB2.0 HUB"
iSerialNumber:        0x00
bNumConfigurations:   0x01

ConnectionStatus: DeviceConnected
Current Config Value: 0x01
Device Bus Speed:     High
Device Address:       0x03
Open Pipes:              1

Endpoint Descriptor:
bEndpointAddress:     0x81  IN
Transfer Type:   Interrupt
wMaxPacketSize:     0x0001 (1)
bInterval:            0x0C

Configuration Descriptor:
wTotalLength:       0x0019
bNumInterfaces:       0x01
bConfigurationValue:  0x01
iConfiguration:       0x00
bmAttributes:         0xE0 (Bus Powered Self Powered Remote Wakeup)
MaxPower:             0x32 (100 Ma)

Interface Descriptor:
bInterfaceNumber:     0x00
bAlternateSetting:    0x00
bNumEndpoints:        0x01
bInterfaceClass:      0x09 (Hub)
bInterfaceSubClass:   0x00
bInterfaceProtocol:   0x00
iInterface:           0x00

Endpoint Descriptor:
bEndpointAddress:     0x81  IN
Transfer Type:   Interrupt
wMaxPacketSize:     0x0001 (1)
bInterval:            0x0C
