Device Descriptor:
bcdUSB:             0x0110
bDeviceClass:         0x00
bDeviceSubClass:      0x00
bDeviceProtocol:      0x00
bMaxPacketSize0:      0x08 (8)
idVendor:           0x0513
idProduct:          0x0318
bcdDevice:          0x0100
iManufacturer:        0x00
iProduct:             0x00
iSerialNumber:        0x00
bNumConfigurations:   0x01

ConnectionStatus: DeviceConnected
Current Config Value: 0x01
Device Bus Speed:     Low
Device Address:       0x06
Open Pipes:              2

Endpoint Descriptor:
bEndpointAddress:     0x81  IN
Transfer Type:   Interrupt
wMaxPacketSize:     0x0008 (8)
bInterval:            0x08

Endpoint Descriptor:
bEndpointAddress:     0x82  IN
Transfer Type:   Interrupt
wMaxPacketSize:     0x0008 (8)
bInterval:            0x08

Configuration Descriptor:
wTotalLength:       0x003B
bNumInterfaces:       0x02
bConfigurationValue:  0x01
iConfiguration:       0x00
bmAttributes:         0xA0 (Bus Powered Remote Wakeup)
MaxPower:             0x32 (100 Ma)

Interface Descriptor:
bInterfaceNumber:     0x00
bAlternateSetting:    0x00
bNumEndpoints:        0x01
bInterfaceClass:      0x03 (HID)
bInterfaceSubClass:   0x01
bInterfaceProtocol:   0x01
iInterface:           0x00

HID Descriptor:
bcdHID:             0x0110
bCountryCode:         0x00
bNumDescriptors:      0x01
bDescriptorType:      0x22
wDescriptorLength:  0x0040

Endpoint Descriptor:
bEndpointAddress:     0x81  IN
Transfer Type:   Interrupt
wMaxPacketSize:     0x0008 (8)
bInterval:            0x08

Interface Descriptor:
bInterfaceNumber:     0x01
bAlternateSetting:    0x00
bNumEndpoints:        0x01
bInterfaceClass:      0x03 (HID)
bInterfaceSubClass:   0x01
bInterfaceProtocol:   0x02
iInterface:           0x00

HID Descriptor:
bcdHID:             0x0110
bCountryCode:         0x00
bNumDescriptors:      0x01
bDescriptorType:      0x22
wDescriptorLength:  0x0077

Endpoint Descriptor:
bEndpointAddress:     0x82  IN
Transfer Type:   Interrupt
wMaxPacketSize:     0x0008 (8)
bInterval:            0x08
