Device Descriptor:
bcdUSB:             0x0210
bDeviceClass:         0x00
bDeviceSubClass:      0x00
bDeviceProtocol:      0x00
bMaxPacketSize0:      0x40 (64)
idVendor:           0x058F (Alcor Micro, Inc.)
idProduct:          0x6387
bcdDevice:          0x0002
iManufacturer:        0x01
0x0409: "Generic"
iProduct:             0x02
0x0409: "Mass Storage"
iSerialNumber:        0x03
0x0409: "45A211E0"
bNumConfigurations:   0x01

ConnectionStatus: DeviceConnected
Current Config Value: 0x01
Device Bus Speed:     High
Device Address:       0x06
Open Pipes:              2

Endpoint Descriptor:
bEndpointAddress:     0x81  IN
Transfer Type:        Bulk
wMaxPacketSize:     0x0200 (512)
bInterval:            0x00

Endpoint Descriptor:
bEndpointAddress:     0x02  OUT
Transfer Type:        Bulk
wMaxPacketSize:     0x0200 (512)
bInterval:            0x00

Configuration Descriptor:
wTotalLength:       0x0020
bNumInterfaces:       0x01
bConfigurationValue:  0x01
iConfiguration:       0x00
bmAttributes:         0x80 (Bus Powered )
MaxPower:             0x64 (200 Ma)

Interface Descriptor:
bInterfaceNumber:     0x00
bAlternateSetting:    0x00
bNumEndpoints:        0x02
bInterfaceClass:      0x08
bInterfaceSubClass:   0x06
bInterfaceProtocol:   0x50
iInterface:           0x00

Endpoint Descriptor:
bEndpointAddress:     0x81  IN
Transfer Type:        Bulk
wMaxPacketSize:     0x0200 (512)
bInterval:            0x00

Endpoint Descriptor:
bEndpointAddress:     0x02  OUT
Transfer Type:        Bulk
wMaxPacketSize:     0x0200 (512)
bInterval:            0x00
