Device Descriptor:
bcdUSB:             0x0110
bDeviceClass:         0x00
bDeviceSubClass:      0x00
bDeviceProtocol:      0x00
bMaxPacketSize0:      0x08 (8)
idVendor:           0x09FB (Altera)
idProduct:          0x6001
bcdDevice:          0x0400
iManufacturer:        0x01
0x0409: "Altera"
iProduct:             0x02
0x0409: "USB-Blaster"
iSerialNumber:        0x03
0x0409: "00000000"
bNumConfigurations:   0x01

ConnectionStatus: DeviceConnected
Current Config Value: 0x01
Device Bus Speed:     Full
Device Address:       0x05
Open Pipes:              2

Endpoint Descriptor:
bEndpointAddress:     0x81  IN
Transfer Type:        Bulk
wMaxPacketSize:     0x0040 (64)
bInterval:            0x01

Endpoint Descriptor:
bEndpointAddress:     0x02  OUT
Transfer Type:        Bulk
wMaxPacketSize:     0x0040 (64)
bInterval:            0x01

Configuration Descriptor:
wTotalLength:       0x0020
bNumInterfaces:       0x01
bConfigurationValue:  0x01
iConfiguration:       0x00
bmAttributes:         0x80 (Bus Powered )
MaxPower:             0x1E (60 Ma)

Interface Descriptor:
bInterfaceNumber:     0x00
bAlternateSetting:    0x00
bNumEndpoints:        0x02
bInterfaceClass:      0xFF
bInterfaceSubClass:   0xFF
bInterfaceProtocol:   0xFF
iInterface:           0x00

Endpoint Descriptor:
bEndpointAddress:     0x81  IN
Transfer Type:        Bulk
wMaxPacketSize:     0x0040 (64)
bInterval:            0x01

Endpoint Descriptor:
bEndpointAddress:     0x02  OUT
Transfer Type:        Bulk
wMaxPacketSize:     0x0040 (64)
bInterval:            0x01